{
    "$schema": "http://json-schema.org/draft-07/schema#",
    "$id": "https://autocam.local/schema/autocam-plan.schema.json",
    "title": "Autocam Plan (v3) — NX 双向验证闭环基础协议",
    "description": "plan 文档是导出（PlanExporter）→ 重建（PlanExecutor）→ 对比（PlanComparer）闭环交换的基础协议实例。本文件 = 协议规范面（设计基准）；执行面 = src/NXPlugins/PlanExporter/Doc.cs 数据模型 + PlanJsonSerializer（DataContractJsonSerializer 投影）+ PlanValidator（可执行语义镜像）+ 参数键集注册表（docs/nx-param-registry-spec.md）。两面相辅相成：设计新增从规范面发起，实证纠正从执行面发起；任何一面变更必须带动另一面同批收敛（头注约定 10）。",
    "$comment": "反推修正（2026-09-06）：v1.5-③/v2/v2.5 各批实证变更后规范面未同批同步，形状声明长期失实（type:object vs 实际 KV 数组、假定缺席语义 vs 实际 null 落盘、目录键无 Doc.cs 成员等）。本批按执行面定稿逻辑一次性反推恢复一致。约定：1) 形状 = DCJS 对 Doc.cs 纯 POCO 的全字段投影：所有成员恒在（无缺席语义）；可空成员以 JSON null 落盘（subtype/safe_plane_z/fixture_offset/mcs/坐标轴/cut_area_signatures）；Dictionary = KV 数组 [{Key,Value}]；ParamValue 值 = {N:number}|{S:串} 二选一。2) 词集 = NX 枚举原文直写（导出直写、重建 Enum.Parse 直用）；schema enum 与代码常量镜像（NxToolWords：Types=14/Subtypes=49；S 值词键 = NxParamWords：cut_pattern/cut_order/cut_direction/transfer_within_levels），不同步即 bug，[U] 词集测试钉住。3) 参数键集开放：strategy/technology 的 Key 为自由串，键权威与逐键语义/NX 落点 = 注册表；导出侧 tech: 前缀键分流进 technology（ExporterCore）。4) nx_template type/subtype 成对非空（NX 侧语义：模板部件名/对象模板类型，OperationCollection.Create 直用；空 subtype 非法）。5) operation_type/feature_type 自由串两档：导出侧实态值 = milling/drilling/other（FamilyToOperationType）与 geometry_group；外部 CAPP/识别素材挂载后再断言词表并递增版本。6) 语义执行体：JSON Schema 不可表达的约束（ref 闭合、operation↔workingstep 1:1、ID 去重、nx_template 成对、tool 词集命中、diag 规则）由 PlanValidator 执行——validator 是规范面的可执行镜像，两面差异即缺陷。7) v1 旧形状读兼容：读侧 NormalizeLegacyValues shim 将旧 strategy/technology KV 裸 number 归一为 {N} 包装（V15-INV-1/2，幂等）；本文件描述现形状。8) 契约版本：contract_version 维持 3.0（本批为声明修正、无外部消费者；未来结构/词集断言变更按约定 5 递增）。9) $id 域名为占位（autocam.local），正式发布前替换或去域。10) 变更纪律：涉及形状/键集/词集/结构的改动，任一面发起（设计新增 → 先修本文件；实证纠正 → 先改执行面），收口 = 本文件 + Doc.cs + PlanValidator + [U] 测试 + 注册表/spec 同批提交，不得单面推进后长期留另一面过期。",
    "type": "object",
    "additionalProperties": false,
    "required": [
        "contract_version",
        "plan_id",
        "name",
        "input_ref",
        "meta",
        "setups",
        "resources",
        "features",
        "operations",
        "workingsteps",
        "workplan",
        "diagnostics"
    ],
    "properties": {
        "contract_version": {
            "const": "3.0",
            "$comment": "合同版本，独立于 plan 业务版本；结构破坏性变更时递增（见头注约定 8）"
        },
        "plan_id": {
            "type": "string",
            "minLength": 1,
            "pattern": "^[A-Za-z0-9._-]+$",
            "description": "plan 唯一标识（导出侧缺省 PLAN-0001）"
        },
        "name": {
            "type": "string",
            "minLength": 1,
            "description": "plan 显示名（导出侧 = 源 prt 描述名；validator 镜像：非空必填）"
        },
        "input_ref": {
            "type": "string",
            "minLength": 1,
            "description": "输入源引用：工程师手编 prj 路径或云端任务 id（ground truth 溯源；validator 镜像：非空必填）"
        },
        "meta": { "$ref": "#/definitions/meta" },
        "setups": {
            "type": "array",
            "items": { "$ref": "#/definitions/setup" },
            "description": "装夹（setup），一个 setup ≈ 一个 MCS/装夹方向"
        },
        "resources": {
            "type": "object",
            "additionalProperties": false,
            "required": ["tools"],
            "properties": {
                "tools": {
                    "type": "array",
                    "items": { "$ref": "#/definitions/tool" }
                }
            }
        },
        "features": {
            "type": "array",
            "items": { "$ref": "#/definitions/feature" },
            "description": "加工特征（组级口径，1 workingstep ↔ 1 feature）：条目 = feature_id + feature_type(恒 geometry_group) + params(恒空数组)"
        },
        "operations": {
            "type": "array",
            "items": { "$ref": "#/definitions/operation" }
        },
        "workingsteps": {
            "type": "array",
            "items": { "$ref": "#/definitions/workingstep" },
            "description": "workingstep：特征×工序×setup 的三方绑定（工序层与特征层的桥）"
        },
        "workplan": {
            "$ref": "#/definitions/workplan",
            "description": "程序组树（Program Order 视图层级），决定刀路输出顺序；根 = 虚拟 PROGRAM（导出侧恒产）"
        },
        "diagnostics": {
            "type": "array",
            "items": { "$ref": "#/definitions/diagnostic" },
            "description": "导出/导入/对比过程的 info/warning/error"
        }
    },

    "definitions": {
        "meta": {
            "type": "object",
            "additionalProperties": false,
            "required": ["generator", "generator_version", "created_at", "notes"],
            "properties": {
                "generator": { "type": "string", "description": "生成器（导出侧恒 PlanExporter；未来 CAPP/手工）" },
                "generator_version": { "type": "string" },
                "created_at": { "type": "string", "format": "date-time", "description": "生成时刻（RFC3339）" },
                "notes": { "type": "string", "description": "备注（可为空串）" }
            }
        },

        "vector3": {
            "type": ["array", "null"],
            "items": { "type": "number" },
            "minItems": 3,
            "maxItems": 3,
            "description": "[x, y, z]，mm（模型局部坐标）；null = 未采集（适配器实证前）"
        },

        "setup": {
            "type": "object",
            "additionalProperties": false,
            "required": ["setup_id", "name", "mcs", "safe_plane_z", "fixture_offset"],
            "properties": {
                "setup_id": { "type": "string", "minLength": 1 },
                "name": { "type": "string", "description": "装夹名（导出侧 = 几何组名，如 MCS_MILL）" },
                "mcs": {
                    "type": ["object", "null"],
                    "required": ["origin", "z_axis", "x_axis"],
                    "properties": {
                        "origin": { "$ref": "#/definitions/vector3", "description": "加工坐标系原点（模型坐标）" },
                        "z_axis": { "$ref": "#/definitions/vector3", "description": "加工坐标系 Z（单位向量）" },
                        "x_axis": { "$ref": "#/definitions/vector3", "description": "加工坐标系 X（单位向量）" }
                    },
                    "description": "MCS（MillOrientGeomBuilder.Mcs）；null = setup 无 MCS 回读（导出侧落 MCS_MISSING error diag）"
                },
                "safe_plane_z": {
                    "type": ["number", "null"],
                    "description": "安全平面 Z 高度 mm（模型坐标）；null = 未设（导入时 NX 侧给默认安全距离）"
                },
                "fixture_offset": {
                    "type": ["integer", "null"],
                    "description": "夹具偏置号（G54=1, G55=2 …；NX 落点 FixtureOffsetBuilder）；null = 未设"
                }
            }
        },

        "tool": {
            "type": "object",
            "additionalProperties": false,
            "required": ["tool_id", "type", "subtype", "diameter", "num_flutes", "flute_length", "lower_corner_radius"],
            "properties": {
                "tool_id": { "type": "string", "minLength": 1 },
                "type": {
                    "type": "string",
                    "enum": ["Mill", "Drill", "Turn", "Groove", "Thread", "Wedm", "Barrel", "Tcutter", "Form", "DrillSpcGroove", "Solid", "MillForm", "Laser", "Soft"],
                    "$comment": "NX2406 Tool.Types 枚举原文 14 值（词集镜像 NxToolWords.Types，U-7 实证 2026-09-04）；导出/校验/重建共用同一词集常量；恒非空（类型读回失败的刀不入本表）"
                },
                "subtype": {
                    "oneOf": [
                        { "type": "string", "enum": ["Undefined", "Mill5", "Mill7", "Mill10", "MillBall", "DrillStandard", "DrillCenterBell", "DrillCountersink", "DrillSpotFace", "DrillSpotDrill", "DrillBore", "DrillReam", "DrillCounterbore", "DrillTap", "DrillBurnishing", "DrillThreadMill", "DrillBackSpotFace", "DrillStep", "TurnStandard", "TurnButton", "TurnBoringBar", "GrooveStandard", "GrooveRing", "GrooveFullNoseRadius", "GrooveUserDefined", "ThreadStandard", "ThreadButress", "ThreadAcme", "ThreadTrapezoidal", "Generic", "Probe", "MillChamfer", "MillSpherical", "DrillCore", "StdLaser", "Laser", "DrillBackCountersink", "CoaxialLaser", "DrillBoringBar", "DrillChamferBoringBar", "DrillBackBore", "ThreadTriangularStandard", "ThreadTriangularTrapezoidal", "BarrelStandard", "BarrelTangent", "BarrelTaper", "BarrelLens", "MillDovetail", "TurnPrime"] },
                        { "type": "null" }
                    ],
                    "description": "NX Tool.Subtypes 原文 49 值（词集镜像 NxToolWords.Subtypes）；null = 空 subtype（不填；真刀读回恒为具体值，Undefined 为合法原文值）"
                },
                "diameter": { "type": ["number", "null"], "exclusiveMinimum": 0, "description": "刀具直径 mm（NX: TlDiameterBuilder）" },
                "num_flutes": { "type": ["integer", "null"], "minimum": 0, "description": "刃数（NX: TlNumFlutesBuilder）" },
                "flute_length": { "type": ["number", "null"], "exclusiveMinimum": 0, "description": "刃长 mm（NX: TlFluteLnBuilder）" },
                "lower_corner_radius": { "type": ["number", "null"], "minimum": 0, "description": "底部圆角 R mm（牛鼻刀；NX: TlLowCorRadBuilder）" }
            },
            "$comment": "导出 MVP 六域（U-7 原文直写，INV-U7-4：类型读回失败的刀不入本表 + error diag）；height/taper 等其余 Tl 参数域不在本契约——扩展 = 先修本文件再实现（头注约定 10）"
        },

        "feature": {
            "type": "object",
            "additionalProperties": false,
            "required": ["feature_id", "feature_type", "params"],
            "properties": {
                "feature_id": { "type": "string", "minLength": 1 },
                "feature_type": {
                    "type": "string",
                    "description": "特征层分类，自由串两档（头注约定 5）：NX 导出侧恒 'geometry_group'（组级口径）；识别模块挂载后可补 AP224 细类并递增版本"
                },
                "params": {
                    "type": "array",
                    "items": {
                        "type": "object",
                        "additionalProperties": false,
                        "required": ["Key", "Value"],
                        "properties": {
                            "Key": { "type": "string", "minLength": 1 },
                            "Value": { "type": "number" }
                        }
                    },
                    "description": "特征参数键值对（DCJS Dictionary<string,double> 投影 = KV 数组）；v1 恒空 []，外部素材挂载后直通"
                }
            }
        },

        "operation": {
            "type": "object",
            "additionalProperties": false,
            "required": ["operation_id", "operation_type", "nx_template", "tool_ref", "method_ref", "strategy", "technology", "cut_area_signatures"],
            "properties": {
                "operation_id": { "type": "string", "minLength": 1 },
                "operation_type": {
                    "type": "string",
                    "minLength": 1,
                    "description": "工序层分类，自由串两档（头注约定 5）：NX 导出侧产实态粗类 milling/drilling/other（FamilyToOperationType）；外部 CAPP 素材挂载后可补细类并递增版本。精确类型语义以 nx_template 成对为准"
                },
                "nx_template": {
                    "type": "object",
                    "additionalProperties": false,
                    "required": ["type", "subtype"],
                    "properties": {
                        "type": {
                            "type": "string",
                            "minLength": 1,
                            "description": "NX 模板部件名（OperationCollection.Create 的 typeName，如 mill_contour / hole_making；空 = 未解析，见 TPL_UNKNOWN diag）"
                        },
                        "subtype": {
                            "type": "string",
                            "minLength": 1,
                            "description": "NX 对象模板类型（Create 的 subtypeName，如 CAVITY_MILL / DRILLING；成对非空——空串在 NX 侧非法，validator 镜像）"
                        }
                    }
                },
                "tool_ref": {
                    "type": "string",
                    "minLength": 1,
                    "description": "指向 resources.tools[].tool_id（闭合由 PlanValidator 执行；悬空引用 → TOOL_REF_DANGLING error diag，实例判非法）"
                },
                "method_ref": { "type": "string", "description": "加工方法组名（如 METHOD）；可为空串" },
                "strategy": { "$ref": "#/definitions/param_items" },
                "technology": { "$ref": "#/definitions/param_items" },
                "cut_area_signatures": {
                    "type": ["array", "null"],
                    "items": { "$ref": "#/definitions/face_signature" },
                    "description": "op 级 CutAreaGeometry 面签名（v2，additive；重建侧据签名在回导件上复刻加工面）。null = 无签名（v1 旧形状无此键读兼容）；非空列表 = 采集签名（0.01mm/0.001 取整值）"
                }
            },
            "$comment": "无 name 成员（v1 起未产出）：op 显示名由 workplan ws 叶 name 承载、归属工序由 diag.operation_id 承载。NX 落点：OperationCollection.Create(4 父组, type, subtype, UseDefaultName, name)"
        },

        "param_items": {
            "type": "array",
            "items": {
                "type": "object",
                "additionalProperties": false,
                "required": ["Key", "Value"],
                "properties": {
                    "Key": {
                        "type": "string",
                        "minLength": 1,
                        "description": "参数键（键集开放：权威 = docs/nx-param-registry-spec.md；导出侧注册表键集采集、tech: 前缀键分流进 technology）"
                    },
                    "Value": { "$ref": "#/definitions/param_value" }
                }
            },
            "description": "参数键值数组（DCJS Dictionary<string,ParamValue> 投影 = KV 数组；空字典 = []）"
        },

        "param_value": {
            "oneOf": [
                { "type": "object", "additionalProperties": false, "required": ["N"], "properties": { "N": { "type": "number", "description": "数值键值（double 原样，POST-4 round-trip）" } } },
                { "type": "object", "additionalProperties": false, "required": ["S"], "properties": { "S": { "type": "string", "description": "枚举键值 = NX 枚举原文串；S 词键 = cut_pattern/cut_order/cut_direction/transfer_within_levels，词集镜像 NxParamWords，重建侧 Enum.Parse 直用（词外 → V15-POST-2 拒绝）" } } }
            ],
            "description": "参数值联合（v1.5-③）：数值 {N} 与枚举原文串 {S} 二选一（EmitDefaultValue=false → 未设成员不落盘）"
        },

        "face_signature": {
            "type": "object",
            "additionalProperties": false,
            "required": ["face_type", "normal_axis", "rx", "ry", "rz", "radius"],
            "properties": {
                "face_type": { "type": "integer", "minimum": 0, "description": "UFModl.AskFaceData 面类型号（实证：22=平面/16=圆柱 等；camprobe-geom）" },
                "normal_axis": { "type": "string", "description": "法向主轴+象限：X+/X-/Y+/Y-/Z+/Z-（自由串六值，导出恒产重建恒匹配）" },
                "rx": { "type": "number", "description": "代表点 x（0.01mm 取整值——采集侧已取整，匹配/比对同粒度）" },
                "ry": { "type": "number" },
                "rz": { "type": "number" },
                "radius": { "type": "number", "minimum": 0, "description": "曲面半径 0.001 取整（平面 = 0）" }
            },
            "$comment": "面身份签名 = U-5 质心/面积禁令后的替代通道（v2 实证：gt 腔 op 13 面签名在 STEP 回导件 26 面中 13/13 唯一命中零歧义）；规格：docs/nx-v2-geom-spec.md"
        },

        "workingstep": {
            "type": "object",
            "additionalProperties": false,
            "required": ["workingstep_id", "feature_ref", "operation_ref", "setup_ref"],
            "properties": {
                "workingstep_id": { "type": "string", "minLength": 1 },
                "feature_ref": { "type": "string", "description": "→ features[].feature_id（非空时闭合由 PlanValidator 执行；1 ws ↔ 1 feature 由导出构造保证）" },
                "operation_ref": { "type": "string", "minLength": 1, "description": "→ operations[].operation_id（1 op ↔ ≤1 ws，PlanValidator 执行）" },
                "setup_ref": { "type": "string", "description": "→ setups[].setup_id；空串 = 无 setup 场景（导出侧 setups 为空时，validator 允许）" }
            }
        },

        "workplan": {
            "type": "object",
            "additionalProperties": false,
            "required": ["root"],
            "properties": {
                "root": { "$ref": "#/definitions/workplan_node" }
            }
        },

        "workplan_node": {
            "type": "object",
            "additionalProperties": false,
            "required": ["kind", "name", "ref", "children"],
            "properties": {
                "kind": { "type": "string", "enum": ["program", "workingstep"], "description": "program=Program 组节点；workingstep=叶子工序节点" },
                "name": { "type": "string", "description": "program：Program 组名（root 恒 PROGRAM）；workingstep：工序显示名（可为空串）" },
                "ref": {
                    "type": "string",
                    "description": "program：对应的 setup_id（按装夹分组的子程序）或父程序名（root 恒空串）；workingstep：workingstep_id（恒非空）"
                },
                "children": {
                    "type": "array",
                    "items": { "$ref": "#/definitions/workplan_node" },
                    "description": "子节点（workingstep 叶恒 []——导出构造保证）"
                }
            },
            "if": { "properties": { "kind": { "const": "workingstep" } }, "required": ["kind"] },
            "then": { "properties": { "children": { "maxItems": 0 } } },
            "$comment": "程序顺序视图层级（刀路输出顺序，v1.5-① 树形：嵌套组真实展开、组内成员序 = NX GetMembers 序）；导出根 = 虚拟 PROGRAM 镜像"
        },

        "diagnostic": {
            "type": "object",
            "additionalProperties": false,
            "required": ["level", "code", "message", "operation_id"],
            "properties": {
                "level": { "type": "string", "enum": ["info", "warning", "error"] },
                "code": { "type": "string", "minLength": 1, "description": "诊断码（如 TPL_AMBIGUOUS / PARAM_UNSUPPORTED；validator：全级必填非空）" },
                "message": { "type": "string", "description": "诊断消息（error 级须非空，validator 执行）" },
                "operation_id": { "type": "string", "description": "归属工序（空串 = 非工序级诊断，如 setup 级 MCS_MISSING；与 op 的对应经 op 名/Tag 链）" }
            },
            "$comment": "历史说明：v2 前 schema 曾声明 scope/data 成员——产物从未产出，已删（实证面无落点）"
        }
    }
}
