{"contract_version":"3.0","diagnostics":[{"code":"TPL_AMBIGUOUS","level":"warning","message":"模板对为默认项（歧义\/未知），需人工\/识别侧复核: 打点_COPY_COPY_COPY","operation_id":"打点_COPY_COPY_COPY"},{"code":"TPL_AMBIGUOUS","level":"warning","message":"模板对为默认项（歧义\/未知），需人工\/识别侧复核: 钻头G83_COPY_3_COPY_COPY_COPY_1","operation_id":"钻头G83_COPY_3_COPY_COPY_COPY_1"}],"features":[{"feature_id":"F-01","feature_type":"geometry_group","params":[]},{"feature_id":"F-02","feature_type":"geometry_group","params":[]},{"feature_id":"F-03","feature_type":"geometry_group","params":[]},{"feature_id":"F-04","feature_type":"geometry_group","params":[]},{"feature_id":"F-05","feature_type":"geometry_group","params":[]},{"feature_id":"F-06","feature_type":"geometry_group","params":[]}],"input_ref":"samples\/test.prt","meta":{"created_at":"2026-09-06T00:07:29+08:00","generator":"PlanExporter","generator_version":"0.1.0","notes":""},"name":"test.prt 导出冒烟（[I] 适配器）","operations":[{"cut_area_signatures":[{"face_type":22,"normal_axis":"Z+","radius":0,"rx":75,"ry":-135.62,"rz":100},{"face_type":22,"normal_axis":"Y+","radius":0,"rx":75,"ry":-90.25,"rz":90},{"face_type":22,"normal_axis":"Z+","radius":0,"rx":75,"ry":-45.12,"rz":80},{"face_type":22,"normal_axis":"X-","radius":0,"rx":85,"ry":39,"rz":88.25},{"face_type":22,"normal_axis":"Z+","radius":0,"rx":75,"ry":36.5,"rz":76.5},{"face_type":22,"normal_axis":"X+","radius":0,"rx":65,"ry":39,"rz":88.25},{"face_type":16,"normal_axis":"Z-","radius":5,"rx":80,"ry":-31,"rz":78.25},{"face_type":22,"normal_axis":"Y+","radius":0,"rx":75,"ry":-36,"rz":78.25},{"face_type":16,"normal_axis":"Z-","radius":5,"rx":70,"ry":-31,"rz":78.25},{"face_type":22,"normal_axis":"Y-","radius":0,"rx":52,"ry":0,"rz":90},{"face_type":22,"normal_axis":"Y-","radius":0,"rx":98,"ry":0,"rz":90},{"face_type":22,"normal_axis":"Z+","radius":0,"rx":52,"ry":54.5,"rz":100},{"face_type":22,"normal_axis":"Z+","radius":0,"rx":98,"ry":54.5,"rz":100}],"method_ref":"METHOD","nx_template":{"subtype":"CAVITY_MILL","type":"mill_contour"},"operation_id":"OP-001","operation_type":"milling","strategy":[{"Key":"cut_pattern","Value":{"S":"FollowPeriphery"}},{"Key":"cut_order","Value":{"S":"DepthFirst"}},{"Key":"cut_direction","Value":{"S":"Climb"}},{"Key":"finish_passes","Value":{"N":0}},{"Key":"boundary_intol","Value":{"N":0}},{"Key":"boundary_outtol","Value":{"N":0}},{"Key":"part_stock","Value":{"N":0.1}},{"Key":"floor_stock","Value":{"N":0}},{"Key":"depth_per_cut","Value":{"N":0.3}}],"technology":[{"Key":"spindle_rpm","Value":{"N":2400}},{"Key":"feed_cut","Value":{"N":2000}}],"tool_ref":"T-001"},{"cut_area_signatures":[{"face_type":16,"normal_axis":"Z-","radius":5,"rx":80,"ry":-31,"rz":78.25},{"face_type":22,"normal_axis":"X-","radius":0,"rx":85,"ry":39,"rz":88.25},{"face_type":22,"normal_axis":"Y+","radius":0,"rx":75,"ry":-36,"rz":78.25},{"face_type":22,"normal_axis":"Z+","radius":0,"rx":75,"ry":36.5,"rz":76.5},{"face_type":16,"normal_axis":"Z-","radius":5,"rx":70,"ry":-31,"rz":78.25},{"face_type":22,"normal_axis":"X+","radius":0,"rx":65,"ry":39,"rz":88.25}],"method_ref":"METHOD","nx_template":{"subtype":"CAVITY_MILL","type":"mill_contour"},"operation_id":"OP-002","operation_type":"milling","strategy":[{"Key":"cut_pattern","Value":{"S":"Profile"}},{"Key":"cut_order","Value":{"S":"DepthFirst"}},{"Key":"cut_direction","Value":{"S":"Climb"}},{"Key":"finish_passes","Value":{"N":0}},{"Key":"boundary_intol","Value":{"N":0}},{"Key":"boundary_outtol","Value":{"N":0}},{"Key":"part_stock","Value":{"N":0}},{"Key":"floor_stock","Value":{"N":0}},{"Key":"depth_per_cut","Value":{"N":0.2}}],"technology":[{"Key":"spindle_rpm","Value":{"N":3000}},{"Key":"feed_cut","Value":{"N":1200}}],"tool_ref":"T-003"},{"cut_area_signatures":[{"face_type":22,"normal_axis":"Z+","radius":0,"rx":98,"ry":54.5,"rz":100},{"face_type":22,"normal_axis":"Z+","radius":0,"rx":52,"ry":54.5,"rz":100},{"face_type":22,"normal_axis":"Z+","radius":0,"rx":75,"ry":-135.62,"rz":100}],"method_ref":"METHOD","nx_template":{"subtype":"CAVITY_MILL","type":"mill_contour"},"operation_id":"OP-003","operation_type":"milling","strategy":[{"Key":"cut_pattern","Value":{"S":"FollowPeriphery"}},{"Key":"cut_order","Value":{"S":"DepthFirst"}},{"Key":"cut_direction","Value":{"S":"Climb"}},{"Key":"finish_passes","Value":{"N":0}},{"Key":"boundary_intol","Value":{"N":0}},{"Key":"boundary_outtol","Value":{"N":0}},{"Key":"part_stock","Value":{"N":0}},{"Key":"floor_stock","Value":{"N":0}},{"Key":"depth_per_cut","Value":{"N":20}}],"technology":[{"Key":"spindle_rpm","Value":{"N":1800}},{"Key":"feed_cut","Value":{"N":500}}],"tool_ref":"T-003"},{"cut_area_signatures":[{"face_type":22,"normal_axis":"Z+","radius":0,"rx":98,"ry":54.5,"rz":100},{"face_type":22,"normal_axis":"Z+","radius":0,"rx":52,"ry":54.5,"rz":100},{"face_type":22,"normal_axis":"Z+","radius":0,"rx":75,"ry":-135.62,"rz":100},{"face_type":22,"normal_axis":"Z+","radius":0,"rx":75,"ry":-45.12,"rz":80},{"face_type":22,"normal_axis":"Y+","radius":0,"rx":75,"ry":-90.25,"rz":90},{"face_type":22,"normal_axis":"Z+","radius":0,"rx":75,"ry":36.5,"rz":76.5},{"face_type":22,"normal_axis":"X-","radius":0,"rx":85,"ry":39,"rz":88.25},{"face_type":16,"normal_axis":"Z-","radius":5,"rx":80,"ry":-31,"rz":78.25},{"face_type":22,"normal_axis":"Y+","radius":0,"rx":75,"ry":-36,"rz":78.25},{"face_type":16,"normal_axis":"Z-","radius":5,"rx":70,"ry":-31,"rz":78.25},{"face_type":22,"normal_axis":"X+","radius":0,"rx":65,"ry":39,"rz":88.25},{"face_type":22,"normal_axis":"Y-","radius":0,"rx":98,"ry":0,"rz":90},{"face_type":22,"normal_axis":"Y-","radius":0,"rx":52,"ry":0,"rz":90}],"method_ref":"METHOD","nx_template":{"subtype":"CAVITY_MILL","type":"mill_contour"},"operation_id":"OP-004","operation_type":"milling","strategy":[{"Key":"cut_pattern","Value":{"S":"FollowPeriphery"}},{"Key":"cut_order","Value":{"S":"DepthFirst"}},{"Key":"cut_direction","Value":{"S":"Climb"}},{"Key":"finish_passes","Value":{"N":0}},{"Key":"boundary_intol","Value":{"N":0}},{"Key":"boundary_outtol","Value":{"N":0}},{"Key":"part_stock","Value":{"N":0}},{"Key":"floor_stock","Value":{"N":0}},{"Key":"depth_per_cut","Value":{"N":20}}],"technology":[{"Key":"spindle_rpm","Value":{"N":1800}},{"Key":"feed_cut","Value":{"N":500}}],"tool_ref":"T-003"},{"cut_area_signatures":null,"method_ref":"METHOD","nx_template":{"subtype":"DRILLING","type":"hole_making"},"operation_id":"OP-005","operation_type":"drilling","strategy":[{"Key":"hole_depth","Value":{"N":0}}],"technology":[{"Key":"spindle_rpm","Value":{"N":3000}},{"Key":"feed_cut","Value":{"N":80}}],"tool_ref":"T-004"},{"cut_area_signatures":null,"method_ref":"METHOD","nx_template":{"subtype":"DRILLING","type":"hole_making"},"operation_id":"OP-006","operation_type":"drilling","strategy":[{"Key":"hole_depth","Value":{"N":0}}],"technology":[{"Key":"spindle_rpm","Value":{"N":500}},{"Key":"feed_cut","Value":{"N":35}}],"tool_ref":"T-005"}],"plan_id":"PLAN-0001","resources":{"tools":[{"diameter":17,"flute_length":50,"lower_corner_radius":0,"num_flutes":2,"subtype":"Mill5","tool_id":"T-001","type":"Mill"},{"diameter":13.94,"flute_length":50,"lower_corner_radius":0,"num_flutes":2,"subtype":"Mill5","tool_id":"T-002","type":"Mill"},{"diameter":9.96,"flute_length":50,"lower_corner_radius":0,"num_flutes":2,"subtype":"Mill5","tool_id":"T-003","type":"Mill"},{"diameter":6,"flute_length":50,"lower_corner_radius":0,"num_flutes":2,"subtype":"MillChamfer","tool_id":"T-004","type":"Mill"},{"diameter":8.5,"flute_length":35,"lower_corner_radius":0,"num_flutes":2,"subtype":"DrillStandard","tool_id":"T-005","type":"Drill"},{"diameter":17.5,"flute_length":35,"lower_corner_radius":0,"num_flutes":2,"subtype":"DrillStandard","tool_id":"T-006","type":"Drill"}]},"setups":[{"fixture_offset":1,"mcs":{"origin":[74.999999999999957,0,100],"x_axis":[2.595146320061303E-15,1,0],"z_axis":[0,-0,1]},"name":"MCS_MILL","safe_plane_z":null,"setup_id":"S-01"}],"workingsteps":[{"feature_ref":"F-01","operation_ref":"OP-001","setup_ref":"S-01","workingstep_id":"WS-01"},{"feature_ref":"F-02","operation_ref":"OP-002","setup_ref":"S-01","workingstep_id":"WS-02"},{"feature_ref":"F-03","operation_ref":"OP-003","setup_ref":"S-01","workingstep_id":"WS-03"},{"feature_ref":"F-04","operation_ref":"OP-004","setup_ref":"S-01","workingstep_id":"WS-04"},{"feature_ref":"F-05","operation_ref":"OP-005","setup_ref":"S-01","workingstep_id":"WS-05"},{"feature_ref":"F-06","operation_ref":"OP-006","setup_ref":"S-01","workingstep_id":"WS-06"}],"workplan":{"root":{"children":[{"children":[],"kind":"program","name":"PROGRAM","ref":""},{"children":[{"children":[],"kind":"workingstep","name":"CAVITY_MILL","ref":"WS-01"},{"children":[],"kind":"workingstep","name":"CAVITY_MILL_COPY","ref":"WS-02"},{"children":[],"kind":"workingstep","name":"CAVITY_MILL_COPY_COPY","ref":"WS-03"},{"children":[],"kind":"workingstep","name":"CAVITY_MILL_COPY_COPY_COPY","ref":"WS-04"},{"children":[{"children":[],"kind":"workingstep","name":"打点_COPY_COPY_COPY","ref":"WS-05"}],"kind":"program","name":"A1-1","ref":""},{"children":[{"children":[],"kind":"workingstep","name":"钻头G83_COPY_3_COPY_COPY_COPY_1","ref":"WS-06"}],"kind":"program","name":"A1-3","ref":""}],"kind":"program","name":"A01","ref":""}],"kind":"program","name":"PROGRAM","ref":""}}}