{
    "contract_version": "3.0",
    "plan_id": "PLAN-0001",
    "name": "demo: 单腔体粗铣（最小闭环）",
    "input_ref": "engineer/handmade/cavity_demo.prt",
    "meta": {
        "generator": "manual",
        "generator_version": "0.1.0",
        "created_at": "2026-09-06T10:00:00+08:00",
        "notes": "手写最小实例（2026-09-06 契约反推批重写）：形状 = DCJS 全字段投影（strategy/technology 为 KV 数组、值 {N}|{S} 二选一）、词集 = NX 枚举原文、参数键 = 注册表白名单持久键（cut_pattern/cut_order/cut_direction/finish_passes/part_stock/floor_stock/depth_per_cut + tech 段 spindle_rpm/feed_cut）。用于 schema 校验与三步闭环冒烟"
    },
    "setups": [
        {
            "setup_id": "S-01",
            "name": "MCS_1",
            "mcs": {
                "origin": [0.0, 0.0, 0.0],
                "z_axis": [0.0, 0.0, 1.0],
                "x_axis": [1.0, 0.0, 0.0]
            },
            "safe_plane_z": 50.0,
            "fixture_offset": 1
        }
    ],
    "resources": {
        "tools": [
            {
                "tool_id": "T-001",
                "type": "Mill",
                "subtype": "Mill5",
                "diameter": 10.0,
                "num_flutes": 4,
                "flute_length": 30.0,
                "lower_corner_radius": 0.0
            }
        ]
    },
    "features": [
        {
            "feature_id": "F-01",
            "feature_type": "geometry_group",
            "params": []
        }
    ],
    "operations": [
        {
            "operation_id": "OP-001",
            "operation_type": "milling",
            "nx_template": {
                "type": "mill_contour",
                "subtype": "CAVITY_MILL"
            },
            "tool_ref": "T-001",
            "method_ref": "METHOD",
            "strategy": [
                { "Key": "cut_pattern", "Value": { "S": "FollowPeriphery" } },
                { "Key": "cut_order", "Value": { "S": "DepthFirst" } },
                { "Key": "cut_direction", "Value": { "S": "Climb" } },
                { "Key": "finish_passes", "Value": { "N": 0 } },
                { "Key": "part_stock", "Value": { "N": 0.1 } },
                { "Key": "floor_stock", "Value": { "N": 0.3 } },
                { "Key": "depth_per_cut", "Value": { "N": 2.0 } }
            ],
            "technology": [
                { "Key": "spindle_rpm", "Value": { "N": 6000 } },
                { "Key": "feed_cut", "Value": { "N": 1200 } }
            ],
            "cut_area_signatures": null
        }
    ],
    "workingsteps": [
        {
            "workingstep_id": "WS-01",
            "feature_ref": "F-01",
            "operation_ref": "OP-001",
            "setup_ref": "S-01"
        }
    ],
    "workplan": {
        "root": {
            "kind": "program",
            "name": "PROGRAM",
            "ref": "",
            "children": [
                {
                    "kind": "program",
                    "name": "PROGRAM_S01",
                    "ref": "S-01",
                    "children": [
                        {
                            "kind": "workingstep",
                            "name": "CAVITY_1",
                            "ref": "WS-01",
                            "children": []
                        }
                    ]
                }
            ]
        }
    },
    "diagnostics": []
}
